{
  "schemaVersion": 1,
  "id": "OBS-MAINTENANCE-SCOPE-001",
  "status": "inbox",
  "scope": "Resumption of the agent maintenance system design in this conversation, 2026-10-13",
  "basis": "observed-failure",
  "observation": "Al retomar el diseño del sistema completo de mantenimiento, el agente centró su siguiente decisión en integrar Laya con Reflect. Mario tuvo que restituir el alcance amplio y señalar que no entendía esa pregunta.",
  "evidence": [
    {
      "source": "Current conversation: assistant resumption response before user's scope clarification",
      "summary": "El agente preguntó si las sugerencias de Laya debían aparecer desde el inicio en las revisiones de Reflect."
    },
    {
      "source": "Current conversation: Mario quotes the prior full-system capability table and says 'No entiendo la pregunta que me haces'",
      "summary": "La aclaración recupera auditoría proactiva, registros, evaluación e instalador como responsabilidades del sistema, con Laya como componente posible."
    }
  ],
  "suspectedCause": null
}
